{
  "$schema": "https://json-schema.org/draft/2020-12/schema",
  "$id": "https://smadp.dev/schema/1.0/chain.schema.json",
  "title": "SMADP Multi-Agent Chain",
  "type": "object",
  "required": [
    "schema_version", "chain_id", "name", "topology", "participants",
    "edges", "headline", "sub_verdicts", "framework_mappings",
    "first_seen_at", "last_refreshed_at"
  ],
  "additionalProperties": false,
  "properties": {
    "schema_version": {"const": "1.0"},
    "chain_id": {"type": "string", "pattern": "^c_[a-z0-9-]{3,80}$"},
    "name": {"type": "string", "minLength": 1, "maxLength": 120},
    "tagline": {"type": "string", "maxLength": 240},
    "topology": {"enum": ["linear", "star", "loop", "tree", "dag"]},
    "participants": {
      "type": "array",
      "minItems": 3,
      "maxItems": 8,
      "items": {
        "type": "object",
        "required": ["slug", "role"],
        "additionalProperties": false,
        "properties": {
          "slug": {"type": "string", "pattern": "^[a-z0-9][a-z0-9-]{1,63}$"},
          "role": {"enum": ["planner", "executor", "critic", "retriever",
                            "reasoner", "writer", "router", "tool",
                            "judge", "memory"]},
          "notes": {"type": "string", "maxLength": 240}
        }
      }
    },
    "edges": {
      "type": "array",
      "items": {
        "type": "object",
        "required": ["from", "to", "channel"],
        "additionalProperties": false,
        "properties": {
          "from": {"type": "string", "pattern": "^[a-z0-9][a-z0-9-]{1,63}$"},
          "to": {"type": "string", "pattern": "^[a-z0-9][a-z0-9-]{1,63}$"},
          "channel": {"enum": ["prompt", "tool-call", "shared-memory",
                               "filesystem", "message-bus"]},
          "carries": {"type": "array", "items": {"type": "string"}}
        }
      }
    },
    "headline": {"type": "string", "minLength": 1, "maxLength": 240},
    "author": {"type": "string", "maxLength": 120},
    "composite_score": {"type": "number", "minimum": 0.0, "maximum": 1.0},
    "max_severity": {"enum": ["none", "low", "medium", "high", "critical"]},
    "evidence_level": {"enum": ["unverified-profile", "docs-only", "behavior-observed", "profile-verified", "sandbox-validated"]},
    "confidence": {"type": "number", "minimum": 0.0, "maximum": 1.0},
    "sub_verdicts": {
      "type": "object",
      "required": ["A_prompt_injection", "B_data_leakage",
                   "C_capability_conflict", "D_cascading_error",
                   "E_compliance"],
      "additionalProperties": false,
      "properties": {
        "A_prompt_injection": {"$ref": "#/$defs/subVerdict"},
        "B_data_leakage": {"$ref": "#/$defs/subVerdict"},
        "C_capability_conflict": {"$ref": "#/$defs/subVerdict"},
        "D_cascading_error": {"$ref": "#/$defs/subVerdict"},
        "E_compliance": {"$ref": "#/$defs/subVerdict"}
      }
    },
    "framework_mappings": {
      "type": "object",
      "additionalProperties": {"type": "array", "items": {"type": "string"}}
    },
    "evidence_refs": {
      "type": "array",
      "items": {"type": "string", "pattern": "^sha256:[0-9a-f]{64}$"}
    },
    "first_seen_at": {"type": "string", "format": "date-time"},
    "last_refreshed_at": {"type": "string", "format": "date-time"}
  },
  "$defs": {
    "subVerdict": {
      "type": "object",
      "required": ["severity", "rationale", "citations", "conditions", "mitigations"],
      "additionalProperties": false,
      "properties": {
        "severity": {"enum": ["none", "low", "medium", "high", "critical"]},
        "rationale": {"type": "string", "minLength": 1, "maxLength": 600},
        "citations": {
          "type": "array",
          "minItems": 1,
          "items": {
            "type": "object",
            "additionalProperties": false,
            "properties": {
              "profile_field": {"type": "string"},
              "evidence_ref": {"type": "string", "pattern": "^sha256:[0-9a-f]{64}$"},
              "quote": {"type": "string"}
            }
          }
        },
        "conditions": {"type": "array", "items": {"type": "string"}},
        "mitigations": {"type": "array", "items": {"type": "string"}, "maxItems": 5}
      }
    }
  }
}
