{
  "chain_id": "c_loop-debug-fix-test",
  "edges": [
    {
      "carries": [
        "bug report"
      ],
      "channel": "prompt",
      "from": "claude-code",
      "to": "cline"
    },
    {
      "carries": [
        "patched files"
      ],
      "channel": "filesystem",
      "from": "cline",
      "to": "claude-code"
    },
    {
      "carries": [
        "regression report"
      ],
      "channel": "prompt",
      "from": "claude-code",
      "to": "cline"
    }
  ],
  "evidence_refs": [],
  "first_seen_at": "2026-05-04T00:00:00Z",
  "framework_mappings": {},
  "headline": "Plan-fix-verify loop runs until tests pass \u2014 uncapped iteration creates cascading-error risk if the critic misjudges.",
  "last_refreshed_at": "2026-05-04T00:00:00Z",
  "name": "Plan \u2192 Fix \u2192 Verify Loop",
  "participants": [
    {
      "role": "planner",
      "slug": "claude-code"
    },
    {
      "role": "executor",
      "slug": "cline"
    },
    {
      "notes": "test-runner",
      "role": "critic",
      "slug": "claude-code"
    }
  ],
  "schema_version": "1.0",
  "sub_verdicts": {
    "A_prompt_injection": {
      "citations": [
        {
          "profile_field": "claude-code.capabilities.execute_shell"
        }
      ],
      "conditions": [],
      "mitigations": [],
      "rationale": "Inputs to the loop are internal (bug reports, test output) and not user-controlled; injection risk is minimal unless test output contains adversarial data.",
      "severity": "low"
    },
    "B_data_leakage": {
      "citations": [
        {
          "profile_field": "cline.capabilities.read_filesystem"
        }
      ],
      "conditions": [],
      "mitigations": [],
      "rationale": "Loop operates within a single codebase; data leakage only occurs if test fixtures or logs expose secrets.",
      "severity": "low"
    },
    "C_capability_conflict": {
      "citations": [
        {
          "profile_field": "claude-code.capabilities.execute_shell"
        }
      ],
      "conditions": [
        "planner and executor use different versions of code"
      ],
      "mitigations": [
        "share repo snapshot between planner and executor"
      ],
      "rationale": "Planner and executor both use claude-code in different roles (planning vs patching), creating risk of conflicting assumptions if the planner's bug diagnosis does not match the executor's fix.",
      "severity": "medium"
    },
    "D_cascading_error": {
      "citations": [
        {
          "profile_field": "claude-code.capabilities.execute_shell"
        }
      ],
      "conditions": [
        "critic lacks independent test oracle",
        "no iteration budget limit"
      ],
      "mitigations": [
        "implement max iteration count",
        "critic checks test coverage",
        "require independent verification before exit"
      ],
      "rationale": "If the test-runner critic incorrectly marks a broken fix as passing, the loop continues with corrupted state. Without a hard iteration limit or external validation, this can cascade indefinitely.",
      "severity": "high"
    },
    "E_compliance": {
      "citations": [
        {
          "profile_field": "cline.data_classes_touched"
        }
      ],
      "conditions": [],
      "mitigations": [],
      "rationale": "Loop is confined to code-level debugging; no regulated data is inherently processed unless the codebase itself contains compliance logic.",
      "severity": "low"
    }
  },
  "topology": "loop"
}
